{
  "id": "stage_1_1",
  "chapter": 1,
  "index": 1,
  "name": "林道遭遇",
  "type": "normal",
  "description": "首战关卡，敌方由轻装弟子组成。",
  "grid": {
    "width": 32,
    "height": 16,
    "deploy_zone": {
      "x_min": 0,
      "x_max": 15,
      "y_min": 0,
      "y_max": 15
    },
    "hex_size": 24.0
  },
  "enemies": [
    { "unit_id": "unit_green_101", "count": 8, "star": 1, "deploy_zone": "front" },
    { "unit_id": "unit_green_102", "count": 6, "star": 1, "deploy_zone": "back" }
  ],
  "obstacles": [
    { "type": "rock", "cells": [[18, 7], [18, 8], [19, 7]] }
  ],
  "rewards": {
    "silver": 10,
    "exp": 2,
    "drops": [
      { "type": "gongfa", "pool": ["gf_wudang_heal", "gf_taijiquan"], "count": 1, "chance": 0.4 },
      { "type": "equipment", "pool": ["eq_junzi", "eq_ruanwei"], "count": 1, "chance": 0.5 }
    ]
  },
  "boss_mechanics": null
}
